data_favorito;id;titulo;categoria;dificuldade;tempo_total;tempo_minutos;calorias;rating_dataset;criterios;ingredientes;passos
2026-01-11T01:30:38;108;Croquete de peixe com limão assado no forno;entrada;muito fácil;20 min;20;92;5.0;sem glúten|sem lactose|sem açúcar;500 gr de filé de pescada (sem espinhos)|1 cebola|50 gr de limão confitado|1 dente alho|1 col. sopa coentro (picado)|1 col. sopa cominho|pimenta;No mixer, misture a cebola, o alho e a polpa do limão confitado, cortado em pedaços.|Acrescente o peixe e misture novamente.|Tempere com pimenta, coentro e cominho. Bata novamente.|Com a ajuda de 2 colheres de sopa, forme os croquetes. Coloque-os então sobre a assadeira já forrada com papel manteiga (papel vegetal).|Leve ao forno por cerca de 10 a 15 minutos a 200°C.|Está pronto!
2026-01-11T01:32:45;100;Salada refrescante de damasco assado, rúcula e burrata;entrada;muito fácil;20 min;20;976;4.5;sem ovo;5 damascos|30 g de rúcula (um punhado grande)|1 queijo burrata|1 col. de sopa de mel|1 col. de sopa de alecrim seco|1 fatia de pão (ou croutons prontos)|azeite de oliva|sal|pimenta|pimenta malagueta (opcional);Lave e corte os damascos ao meio no sentido do comprimento.|Doure os damascos em uma frigideira quente com um fio de azeite de oliva.|Depois de cozinhar por 2 minutos, adicione o mel, o alecrim seco, o sal e a pimenta. Cozinhe por 5 minutos em fogo médio e reserve.|Na mesma frigideira, frite os croutons de pão de forma cortados grosseiramente por cerca de 2 minutos.|Monte a salada: coloque a rúcula no fundo do prato, os damascos assados com mel, uma boa burrata, os croutons de pão, um fio de azeite de oliva e pimenta malagueta (opcional). Sua salada de verão está pronta :)
2026-01-11T01:45:43;27;Salada de pepino com molho de iogurte;entrada;muito fácil;5 min;5;52;4.87;sem glúten|vegetariano|sem açúcar|sem ovo;1 copo de iogurte natural|sumo de 1/2 limão|sal|pimenta|3 gr salsa (1 punhado)|1 pepino;Descasque o pepino e corte-o em cubos ou rodelas.|Molho de iogurte: misture o iogurte com o sumo do limão, uma pitada de sal, uma pitada de pimenta e um punhado de salsa picada.|Misture tudo: o molho com o pepino|Está pronto.
2026-01-11T01:46:02;923;Waffles super proteicos com whey;sobremesa;muito fácil;8 min;8;125;5.0;vegetariano|sem açúcar;100 g de farinha de trigo|2 ovos|1 col. de chá de fermento em pó|180 ml de leite (de vaca ou vegetal)|35 g de whey baunilha (ou outro sabor);Coloque todos os ingredientes no mixer.|Misture até ficar homogêneo.|Unte a forma de waffle.|Despeje a massa na forma de waffle. Cozinhe os waffles por cerca de 3 minutos (dependendo da potência da sua máquina de waffles).|Retire os waffles quando estiverem dourados.|Está pronto. Bom apetite!
2026-01-11T01:46:46;49;Sopa fria de ervilhas (fácil);entrada;muito fácil;20 min;20;965;4.15;sem açúcar|sem ovo;250 gr de ervilhas (cozidas ou congeladas)|200 ml caldo de legumes|1 col. sopa de natas (creme de leite)|sal|pimenta|hortelã (ou folhas de menta);Com a ajuda da varinha mágica, misture as ervilhas com o caldo frio.|Em seguida, junte as natas, o sal, a pimenta e misture novamente.|Por último as folhas de hortelã.|Deixe agora a mistura na geladeira por 15 minutos.|Ao servir, decore com um fio de azeite e pedacinhos do queijo feta.|Está pronto! Gostou? Deixe seu comentário.
